Handle,Title,Body (HTML),Vendor,Product Category,Type,Tags,Published,Option1 Name,Option1 Value,Option2 Name,Option2 Value,Variant SKU,Variant Grams,Variant Price,Variant Requires Shipping,Image Src,Image Alt Text,SEO Title,SEO Description,Status
classic-leather-moto-jacket,Classic Leather Moto Jacket,"<p>Premium genuine leather moto jacket with tailored fit and edge.</p>",TryOnYou,Apparel & Accessories > Clothing > Outerwear > Coats & Jackets,Jackets,"Leather, Jacket",FALSE,Size,S,Fit,Slim,TYJCK_LTH_111,800,199.0,TRUE,https://via.placeholder.com/600x800,Classic Leather Moto Jacket,Classic Leather Moto Jacket | TryOnMe,Shop our premium leather moto jacket. Timeless, edgy and tailored for a perfect fit.,draft
urban-bomber-jacket,Urban Bomber Jacket,"<p>Lightweight nylon bomber for casual streetwear comfort and style.</p>",TryOnYou,Apparel & Accessories > Clothing > Outerwear > Coats & Jackets,Jackets,"Bomber, Jacket",FALSE,Size,M,Fit,Regular,TYJCK_NYL_122,650,79.0,TRUE,https://via.placeholder.com/600x800,Urban Bomber Jacket,Urban Bomber Jacket | TryOnMe,Discover the sleek, lightweight bomber jacket made for urban style.,draft
casual-day-dress,Casual Day Dress,"<p>Relaxed fit cotton dress. Minimalist and flattering for daily wear.</p>",TryOnYou,Apparel & Accessories > Clothing > Dresses,Dresses,"Dress, Casual",FALSE,Size,L,Fit,Regular,TYDRS_CTN_133,300,50.0,TRUE,https://via.placeholder.com/600x800,Casual Day Dress,Casual Day Dress | TryOnMe,Your go-to cotton day dress with relaxed elegance and soft feel.,draft
mens-formal-white-shirt,Men's Formal White Shirt,"<p>Crisp cotton shirt with sharp collar and tailored cuffs.</p>",TryOnYou,Apparel & Accessories > Clothing > Clothing Tops > Shirts,Shirts,"Shirt, Formal",FALSE,Size,M,Fit,Slim,TYSHT_CTN_211,250,45.0,TRUE,https://via.placeholder.com/600x800,Men's Formal White Shirt,Formal White Shirt | TryOnMe,Perfectly tailored white shirt for office or special occasions.,draft
high-top-sneakers,High-Top Sneakers,"<p>Canvas high-tops with cushioned soles and urban style.</p>",TryOnYou,Apparel & Accessories > Shoes > Sneakers,Shoes,"Sneakers, Unisex",FALSE,Size,S,Fit,Regular,TYSHS_CNV_111,700,80.0,TRUE,https://via.placeholder.com/600x800,High-Top Sneakers,High-Top Sneakers | TryOnMe,Stylish high-top sneakers with comfort for daily moves.,draft
